config,question,in_doc,top_score,controls_triggered,abstained,verdict,answer
Baseline,Eye for an Eye is a 1996 American psychological thriller film starring an American actor who currently stars in what HBO sci-fi drama series?,True,0.687,,False,GROUNDED,"Eye for an Eye는 1996년 미국의 심리 스릴러 영화로, 현재 HBO의 공상 과학 드라마 시리즈 ""Westworld""에 출연 중인 미국 배우 에드 해리스(Edward Harris)가 출연합니다."
Baseline,Are nucleoside analogues activated by bacterial deoxyribonucleoside kinases in a species-specific manner?,False,0.265,,False,GROUNDED,"주어진 참고 문서에서는 핵산 유사체(nucleoside analogues)와 관련된 내용이나 박테리아의 디옥시리보뉴클레오사이드 키나제(deoxyribonucleoside kinases)에 대한 정보가 포함되어 있지 않습니다. 따라서, 박테리아의 디옥시리보뉴클레오사이드 키나제가 종 특이적으로 핵산 유사체를 활성화하는지에 대한 질문에 대한 답변을 제공할 수 없습니다.  핵산 유사체의 활성화는 일반적으로 특정 효소의 작용에 의존하며, 이러한 효소는 종에 따라 다를 수 있습니다. 그러나 이와 관련된 구체적인 연구 결과나 데이터는 제공된 문서에 포함되어 있지 않으므로, 추가적인 문헌 조사가 필요할 것입니다."
Baseline,What city in California was home to a team that Robert Girard played hockey for?,True,0.699,,False,GROUNDED,"Robert Girard played for the California Golden Seals, which were based in Oakland, California."
Baseline,The designers of the Horten H.XVIII also designed the world's first jet-powered flying wing known by what name?,False,0.207,,False,HALLUCINATED,"Horten H.XVIII의 설계자들은 세계 최초의 제트 동력 비행 날개인 ""Horten Ho 229""를 설계했습니다. Horten Ho 229는 독일의 Horten 형제가 개발한 비행기로, 제2차 세계 대전 중에 비행기 디자인의 혁신을 보여주는 중요한 사례입니다."
Baseline,Which French boxer defeated Hussein Ishaish at the 2016 Summer Olympics as an amateur?,False,0.343,,False,GROUNDED,"참고 문서에는 2016년 하계 올림픽에서 Hussein Ishaish를 이긴 프랑스 복서에 대한 정보가 포함되어 있지 않습니다. 하지만, 2016년 하계 올림픽에서 프랑스 복서인 Sofiane Oumiha가 Hussein Ishaish를 이긴 것으로 알려져 있습니다. 추가적인 정보가 필요하시면 말씀해 주세요!"
Baseline,How many countries were Circassian refugees thought to be fleeing to?,False,0.322,,False,GROUNDED,주어진 참고 문서에는 Circassian 난민이 도망치고 있는 국가에 대한 정보가 포함되어 있지 않습니다. 따라서 이 질문에 대한 정확한 답변을 제공할 수 없습니다. Circassian 난민에 대한 구체적인 정보가 필요하다면 다른 자료를 참조하시거나 추가적인 질문을 해주시면 도움을 드리겠습니다.
Baseline,What form of theater do Sean Pol McGreevy and Mack and Mabel have in common?,False,0.229,,False,HALLUCINATED,"Sean Pol McGreevy와 ""Mack and Mabel""이 공통적으로 가지고 있는 극장 형태는 뮤지컬입니다. ""Mack and Mabel""은 1974년에 개막한 뮤지컬로, 할리우드의 초기 영화 산업과 그 시대의 유명한 인물들인 맥스 스너드와 메이블 노먼드의 이야기를 다루고 있습니다. Sean Pol McGreevy는 뮤지컬과 관련된 작업을 하는 아티스트로, 그가 참여한 작품에서도 뮤지컬 형식이 사용될 가능성이 높습니다."
+Faithfulness,Archduchess Catherine Renata of Austria is a member of one of the most influential and outstanding royal houses of Europe that was occupied by who between 1438-1740?,True,0.812,faithfulness_check,True,GROUNDED,제공된 문서에 근거가 없어 답변드릴 수 없습니다.
+Faithfulness,"What 2006 criminal case led by Mike Nifong was the basis of an episode of ""Law & Order""?",True,0.659,,False,GROUNDED,"2006년 마이크 니폰(Mike Nifong)이 이끌었던 형사 사건은 듀크 대학교 남자 라크로스 팀의 세 명의 선수들이 잘못된 성폭행 혐의를 받았던 듀크 라크로스 사건(Duke lacrosse case)입니다. 이 사건은 ""Law & Order""의 에피소드 ""Out of Control""의 기초가 되었습니다. 사건의 해결은 인종차별, 미디어 편향, 캠퍼스에서의 적법 절차에 대한 공적 논의를 촉발하였고, 결국 주도 검사인 더럼 카운티 지방 검사 마이크 니폰의 사임과 변호사 자격 박탈로 이어졌습니다."
+Faithfulness,Who is Ronald Dworkin?,False,0.256,faithfulness_check,True,GROUNDED,제공된 문서에 근거가 없어 답변드릴 수 없습니다.
+Faithfulness,What game was Sidney Crosby awarded his second Conn Smythe Trophy?,False,0.292,faithfulness_check,True,GROUNDED,제공된 문서에 근거가 없어 답변드릴 수 없습니다.
+Faithfulness,Vanessa Kirby played Joanna Richard Curtis' movie released on what date?,True,0.424,faithfulness_check,True,GROUNDED,제공된 문서에 근거가 없어 답변드릴 수 없습니다.
+Faithfulness,Where did Beatrice Helen Beckett's husband serve as prime minister?,False,0.327,faithfulness_check,True,GROUNDED,제공된 문서에 근거가 없어 답변드릴 수 없습니다.
+Faithfulness,What Trust did the author of The Tale of Jemima Puddle-Duck leave her house to?,False,0.237,faithfulness_check,True,GROUNDED,제공된 문서에 근거가 없어 답변드릴 수 없습니다.
+Faithfulness,"Israeli actress, Odeya Rush, is known for her lead role in 2015 American horror comedy film based on the children's book series created by what author?",True,0.688,,False,GROUNDED,"Odeya Rush는 2015년 미국의 호러 코미디 영화 ""Goosebumps""에서 주연을 맡았으며, 이 영화는 R.L. Stine이 만든 어린이 책 시리즈를 기반으로 하고 있습니다."
+Faithfulness,Is resection of residual disease after isolated limb infusion ( ILI ) equivalent to a complete response after ILI-alone in advanced extremity melanoma?,False,0.229,faithfulness_check,True,GROUNDED,제공된 문서에 근거가 없어 답변드릴 수 없습니다.
+Faithfulness,"Who was born first, Ken Hughes or Peter Duffell?",False,0.267,,False,GROUNDED,주어진 참고 문서에는 Ken Hughes와 Peter Duffell에 대한 정보가 포함되어 있지 않습니다. 따라서 이 두 인물 중 누가 먼저 태어났는지에 대한 정보를 제공할 수 없습니다. 추가적인 정보를 제공해 주시면 더 도움을 드릴 수 있습니다.
+Faithfulness,"When was the singer of ""Funny Face"" born? ",False,0.245,faithfulness_check,True,GROUNDED,제공된 문서에 근거가 없어 답변드릴 수 없습니다.
+Faithfulness,Is bilirubin independently associated with oxidized LDL levels in young obese patients?,False,0.303,faithfulness_check,True,GROUNDED,제공된 문서에 근거가 없어 답변드릴 수 없습니다.
+Faithfulness,What is the FY2020 unadjusted EBITDA less capex for PepsiCo? Define unadjusted EBITDA as unadjusted operating income + depreciation and amortization [from cash flow statement]. Answer in USD millions. Give a response to the question by relying on the details shown in the P&L statement and the statement of cash flows.,False,0.421,faithfulness_check,True,GROUNDED,제공된 문서에 근거가 없어 답변드릴 수 없습니다.
+Faithfulness,"Godspeed, was under Captain Bartholomew Gosnold, an English lawyer, explorer, and privateer who was instrumental in founding of which organization?",False,0.283,faithfulness_check,True,GROUNDED,제공된 문서에 근거가 없어 답변드릴 수 없습니다.
+Faithfulness,"From the perspective of a public equities analyst, please answer the following question by primarily taking information that is provided in the P&L statement and the cash flow statement. What is Amcor's FY2020 retention ratio (using total cash dividends paid and net income attributable to shareholders)? Round answer to two decimal places.",False,0.473,faithfulness_check,True,GROUNDED,제공된 문서에 근거가 없어 답변드릴 수 없습니다.
+Faithfulness,Are both Roberto Devereux and King Priam operas?,True,0.744,,False,GROUNDED,"네, Roberto Devereux와 King Priam은 모두 오페라입니다. Roberto Devereux는 가에타노 도니제티(Gaetano Donizetti)가 작곡한 ""tragédia lirica"" 또는 비극 오페라입니다. 반면, King Priam은 마이클 티펫(Michael Tippett)이 자신의 리브레토를 바탕으로 작곡한 오페라입니다. 두 작품 모두 오페라 장르에 속합니다."
+Faithfulness,Who is married to Jim Tomlinson and released an album entitled Raconte-moi?,True,0.636,,False,GROUNDED,"Stacey Kent는 Jim Tomlinson과 결혼한 재즈 가수이며, 2010년에 ""Raconte-moi""라는 앨범을 발표했습니다."
+Faithfulness,Is kAP1 associated with peritoneal carcinomatosis in gastric cancer?,True,0.726,,False,GROUNDED,"네, KAP1은 위암에서 복막암종(peritoneal carcinomatosis)과 관련이 있습니다. 연구 결과에 따르면, KAP1의 발현이 높은 환자들은 복막암종의 발생률이 더 높았으며(P < .05), KAP1의 높은 발현은 독립적인 예후 인자로 나타났습니다. 즉, KAP1의 발현 수준이 높을수록 복막암종의 위험이 증가하는 것으로 보입니다. 이러한 결과는 KAP1이 위암의 진행 및 예후에 중요한 역할을 할 수 있음을 시사합니다."
+Faithfulness,"What 1977 film written and directed by Claude Chabrol is loosely based on a novel by the author of the poem ""Jabberwocky""?",True,0.631,,False,GROUNDED,"1977년 영화 ""Alice or the Last Escapade"" (프랑스어: ""Alice ou la dernière fugue"")는 Claude Chabrol이 쓰고 감독한 작품으로, 루이스 캐럴의 ""Alice's Adventures in Wonderland""에 매우 느슨하게 영감을 받았습니다. 루이스 캐럴은 ""Jabberwocky""라는 시의 저자이기도 합니다. 이 영화의 주인공 이름은 Alice Carroll로, 캐럴의 작품 속 Alice 캐릭터와 그의 필명인 캐럴을 결합한 것입니다."
+Faithfulness,"Jon Ippolito is an artist, educator, new media scholar, and former curator at the Solomon R. Guggenheim Museum, the museum is often referred to as The Guggenheim, is an art museum located at 1071 Fifth Avenue on the corner of East 89th Street in the Upper East Side neighborhood of Manhattan, in which city?",False,0.303,faithfulness_check,True,GROUNDED,제공된 문서에 근거가 없어 답변드릴 수 없습니다.
+Faithfulness,What is the name of the 1972 film based on Nicholas Monsarrat's novel and stars Colin Blakely?,True,0.574,,False,GROUNDED,"The name of the 1972 film based on Nicholas Monsarrat's novel and starring Colin Blakely is ""Something to Hide,"" which was also reissued in the U.S. as ""Shattered."""
+Faithfulness,"Along with the New York Islanders and the New York Rangers, which other NHL franchise is popular in the New York metropolitan area?",False,0.249,faithfulness_check,True,GROUNDED,제공된 문서에 근거가 없어 답변드릴 수 없습니다.
+Faithfulness,Which politician was once a Lieutenant Governor of Kentucky and a mayor in Louisville?,True,0.422,,False,GROUNDED,"그 정치인은 제리 아브람슨(Jerry Abramson)입니다. 그는 켄터키주에서 55대 부지사로 재직했으며, 루이빌의 시장으로도 활동했습니다."
+Faithfulness,In what year was the camp opened that is between the city of Wodonga and the dam across the Murray River downstream of its junction with the Mitta River?,False,0.204,faithfulness_check,True,GROUNDED,제공된 문서에 근거가 없어 답변드릴 수 없습니다.
+Faithfulness,Buddhist Yip Kei Nam Memorial College the school was founded with funds from a gambling tycoon whose wealth was estimated to be what?,True,0.663,,False,GROUNDED,"Buddhist Yip Kei Nam Memorial College was founded with funds from Yip Hon (葉漢), a gambling tycoon in Hong Kong and Macau, whose wealth was estimated to be HK$ 100 million."
+Faithfulness,"Gerald William Heaney, served for nearly forty years as a federal judge on the United States Court of Appeals for the Eighth Circuit, and was an organizer for several liberal Democratic politicians, including which former   American politician, poet, and a long-time Congressman from Minnesota?",True,0.472,,False,GROUNDED,"Gerald William Heaney는 여러 리버럴 민주당 정치인들을 위해 조직자로 활동했으며, 그 중에는 유진 맥카시(Eugene McCarthy)가 포함됩니다. 유진 맥카시는 미국의 정치인, 시인, 그리고 미네소타주에서 오랜 기간 동안 의원으로 활동한 인물입니다."
+Faithfulness,What 2014 American 3D computer-animated musical fantasy adventure comedy film features a song recorded by British singer Leah McFall?,False,0.293,faithfulness_check,True,GROUNDED,제공된 문서에 근거가 없어 답변드릴 수 없습니다.
+Faithfulness,"Who is older, Michael Howard or Clark Johnson?",False,0.252,,False,GROUNDED,제공된 참고 문서에는 Michael Howard와 Clark Johnson에 대한 정보가 포함되어 있지 않습니다. 따라서 이 두 사람의 나이를 비교할 수 없습니다. 추가적인 정보를 제공해 주시면 더 도움을 드릴 수 있습니다.
+Faithfulness,Are Jan Bucquoy and Richard Linklater of the same nationality?,True,0.73,,False,GROUNDED,"아니요, Jan Bucquoy와 Richard Linklater는 서로 다른 국적을 가지고 있습니다. Jan Bucquoy는 벨기에에서 태어난 반정부주의자이자 작가-영화 제작자로, 벨기에 국적을 가지고 있습니다. 반면, Richard Linklater는 미국에서 태어난 영화 제작자, 각본가, 배우로, 미국 국적을 가지고 있습니다. 따라서 두 사람은 서로 다른 국적입니다."
+Faithfulness,Does association of Dry Eye test With Extraocular Signs Among 3514 Participants in the Sjögren 's Syndrome International Registry?,False,0.273,faithfulness_check,True,GROUNDED,제공된 문서에 근거가 없어 답변드릴 수 없습니다.
+Faithfulness,Which alcoholic brand named after the man who rebuilt its business did Justin Timberlake sing about in 2015?,True,0.642,,False,GROUNDED,"Justin Timberlake sang about the alcoholic brand ""Jim Beam"" in his song ""Drink You Away,"" which is featured on his fourth studio album, ""The 20/20 Experience – 2 of 2,"" released in 2013. The brand is named after James B. Beam, who rebuilt the business after Prohibition ended."
+Faithfulness,How many months did the Eastern Legion train for?,True,0.262,faithfulness_check,True,GROUNDED,제공된 문서에 근거가 없어 답변드릴 수 없습니다.
+Faithfulness,The 1996 Air Force Falcons finished the season with a 5–3 record in in an American collegiate athletic conference formed on what date?,True,0.77,,False,GROUNDED,1996 Air Force Falcons는 Western Athletic Conference (WAC)에서 5–3의 기록으로 시즌을 마쳤습니다. 이 WAC는 1962년 7월 27일에 설립된 미국의 대학 운동 회의입니다.
+Faithfulness,What goalkeeper participated in a football game for the premiere of A Trip to Jamaica?,True,0.593,,False,GROUNDED,"The goalkeeper who participated in the celebrity football game for the premiere of ""A Trip to Jamaica"" is Peter Rufai. He is a retired Nigerian footballer known for his role as a goalkeeper."
+Faithfulness,How many cities weren't ranked the top destination city by international visitor arrivals in the Global Destination Cities Index 2018?,True,0.521,,False,GROUNDED,"Global Destination Cities Index 2018에서 방콕이 국제 방문자 도착 수에 따라 가장 높은 순위를 차지했습니다. 이 지수는 전 세계 162개 도시를 평가했으므로, 방콕을 제외한 161개 도시가 방콕보다 높은 순위를 기록하지 않았습니다. 따라서 방콕을 제외한 161개 도시가 Global Destination Cities Index 2018에서 가장 높은 순위를 차지하지 않았습니다."
+Faithfulness,differences and similarities between red and white blood cells,False,0.118,faithfulness_check,True,GROUNDED,제공된 문서에 근거가 없어 답변드릴 수 없습니다.
+Faithfulness,Kuk Harrell won his fourth Grammy for the song by Rihanna from what album?,True,0.624,,False,GROUNDED,"Kuk Harrell won his fourth Grammy for the vocal production of Rihanna's song ""Only Girl (In the World)"", which is from her fifth album, ""Loud"" released in 2010."
+Faithfulness,Who directed the film for which Danny Michael was nominated for an Academy Award ? ,True,0.404,faithfulness_check,True,GROUNDED,제공된 문서에 근거가 없어 답변드릴 수 없습니다.
+Faithfulness,Dave Goelz is the voice of a character on a ride at Epcot theme park that also features what song?,False,0.364,faithfulness_check,True,GROUNDED,제공된 문서에 근거가 없어 답변드릴 수 없습니다.
+Faithfulness,"Which ""Outlaw"" star was nominated for an Emmy in 2013?",False,0.344,faithfulness_check,True,GROUNDED,제공된 문서에 근거가 없어 답변드릴 수 없습니다.
+Faithfulness,Who is the president of organization that Forrest Griffin vs. Stephan Bonnar was thought to be one of the greatest fights in history?,True,0.762,,False,GROUNDED,"Forrest Griffin vs. Stephan Bonnar는 UFC의 역사에서 가장 위대한 싸움 중 하나로 여겨지며, UFC의 대통령은 Dana White입니다."
+Faithfulness,What was the name of the group of British colonies that the Tilden family originated from?,False,0.236,,False,GROUNDED,참고 문서에는 Tilden 가족의 기원에 대한 정보가 포함되어 있지 않습니다. Tilden 가족이 어떤 특정한 영국 식민지에서 유래했는지에 대한 정보는 제공되지 않았습니다. 추가적인 정보가 필요하시다면 다른 자료를 찾아보시는 것이 좋습니다.
+Faithfulness,John Craig Freeman is a professor at a college founded by who ?,False,0.34,faithfulness_check,True,GROUNDED,제공된 문서에 근거가 없어 답변드릴 수 없습니다.
+Faithfulness,"Latrobe Brewing Company in Latrobe, Pennsylvania, founded in 1839, was one of the largest breweries in the United States and the maker of ""Rolling Rock"" beer, which merged later in 2004, into which brewing company that resulted from the merger between Belgium-based company Interbrew and Brazilian brewer AmBev?",True,0.586,,False,GROUNDED,"Latrobe Brewing Company, known for producing ""Rolling Rock"" beer, was acquired by Labatt Brewing Company in 1987. Labatt itself was later purchased by Interbrew in 1995. Interbrew then merged with Brazilian brewer AmBev in 2004 to form InBev. Therefore, Latrobe Brewing Company ultimately merged into InBev, the brewing company that resulted from the merger between Interbrew and AmBev."
+Faithfulness,Which player from the University of Texas 1994 Sun Bowl team was later signed to the Baltimore Ravens?,True,0.638,,False,GROUNDED,1994 Sun Bowl 팀에서 텍사스 대학교의 선수로 활약한 Priest Holmes가 나중에 1997년 볼티모어 레이븐스에 무급 자유 계약 선수로 서명되었습니다.
+Faithfulness,Ray Winstone appeared in what 2005 French-British computer-animated adventure fantasy that was based on a TV series?,False,0.312,faithfulness_check,True,GROUNDED,제공된 문서에 근거가 없어 답변드릴 수 없습니다.
+Faithfulness,"Which breed was developed first, the Doberman Pinscher or the Old Time Farm Shepherd?",False,0.172,faithfulness_check,True,GROUNDED,제공된 문서에 근거가 없어 답변드릴 수 없습니다.
+Faithfulness,What former Governor Of New York helped found the American Bison Society?,True,0.633,,False,GROUNDED,The former Governor of New York who helped found the American Bison Society (ABS) is Theodore Roosevelt. He was a pioneering conservationist and played a significant role in raising public awareness about the bison and efforts to save the species from extinction.
+Faithfulness,"Which is farther east, Minneapolis–Saint Paul International Airport or Cheyenne Regional Airport?",True,0.702,,False,GROUNDED,"Minneapolis–Saint Paul International Airport (MSP) is farther east than Cheyenne Regional Airport (CYS). Minneapolis–Saint Paul is located in Minnesota, while Cheyenne Regional Airport is in Wyoming. Geographically, Minnesota is situated to the east of Wyoming, making MSP the easternmost of the two airports."
+Faithfulness,what causes necrotizing fasciitis,True,0.71,,False,GROUNDED,"Necrotizing fasciitis is primarily caused by bacteria, with group A beta-hemolytic streptococci (Streptococcus pyogenes) being the most common culprit. This type of bacteria is also responsible for other infections such as strep throat and impetigo. In addition to group A streptococcus, other bacteria like staphylococcus can also be associated with necrotizing fasciitis.  The infection typically occurs when these bacteria invade the superficial fascia, which is a layer of connective tissue located just beneath the skin. Many cases of necrotizing fasciitis are preceded by some form of trauma, such as cuts, scrapes, insect bites, burns, or even surgical incisions. These initial injuries may seem minor but can lead to serious infections if bacteria enter the body through them. Although necrotizing fasciitis is rare, it is a serious condition that can rapidly destroy skin, fat, and muscle tissue."
+Faithfulness,What is the name of one of the native species of buckthorn that is also a powerful plant-based laxative?,True,0.635,,False,GROUNDED,"The name of the native species of buckthorn that is also a powerful plant-based laxative is Rhamnus purshiana, commonly known as cascara sagrada."
+Faithfulness,Who is the current head coach of the basketball team for which Michael Beasley played for one year before declaring for the NBA draft in 2008?,False,0.267,faithfulness_check,True,GROUNDED,제공된 문서에 근거가 없어 답변드릴 수 없습니다.
+Faithfulness,lyrics he was a friend of mine,True,0.672,,False,GROUNDED,"""He Was a Friend of Mine""는 친구의 죽음을 애도하는 내용을 담고 있는 곡입니다. 이 노래의 가사는 친구가 돈도 없이 세상을 떠났다는 슬픈 이야기를 담고 있으며, 친구에 대한 그리움과 애정이 표현되어 있습니다. 가사 중 일부는 다음과 같습니다:  ""He was a friend of mine, he was a friend of mine. He died without a penny, he didn't have a dime...""  이처럼 노래는 친구의 삶과 그가 남긴 기억을 회상하며, 그리움과 슬픔을 전합니다. 이 곡은 여러 아티스트에 의해 리메이크되었으며, 특히 밥 딜런이 작곡한 것으로 알려져 있습니다."
+Faithfulness,Ishmael Muhammad is the assistant minister to which leader formerly known as Louis X?,True,0.507,,False,GROUNDED,"Ishmael Muhammad는 Louis X로 알려졌던 Louis Farrakhan의 국가 보조 장관입니다. Louis Farrakhan은 미국의 종교 지도자이자 아프리카계 미국인 활동가, 사회 논평가로 알려져 있습니다."
+Faithfulness,"Who did Eric Hilton found ESL Music, the independent record label in Washington DC, with?",False,0.255,faithfulness_check,True,GROUNDED,제공된 문서에 근거가 없어 답변드릴 수 없습니다.
+Faithfulness,In what television show did the Life Under Water actress win two Emmys for in 2001 and 2004?,False,0.315,,False,GROUNDED,"주어진 참고 문서에는 ""Life Under Water""라는 제목의 작품이나 해당 작품에서 에미상을 수상한 여배우에 대한 정보가 포함되어 있지 않습니다. 따라서 해당 질문에 대한 정확한 답변을 제공할 수 없습니다. 추가적인 정보나 다른 질문이 있다면 도와드리겠습니다!"
+Faithfulness,"On which semi-autobiographical film is based the 2009 romantic musical drama, which features an ensemble cast including the English actress who made her debut with the Old Vic Company?",False,0.435,faithfulness_check,True,GROUNDED,제공된 문서에 근거가 없어 답변드릴 수 없습니다.
+Faithfulness,what opening day attraction at EPCOT Center in 1982 was closed down for refurbishment in 1995,True,0.64,,False,GROUNDED,EPCOT Center의 1982년 개장일 어트랙션 중 하나인 Horizons가 1995년에 리노베이션을 위해 폐쇄되었습니다. 이 어트랙션은 1996년에 Test Track이라는 새로운 스릴 라이드를 위해 완전히 문을 닫았습니다.
+Faithfulness,"What is the name of the song that was written by Ed Sheeran, Benny Blanco and Bieber, and was remixed by Zaeden, an Indian DJ and music producer?",False,0.28,faithfulness_check,True,GROUNDED,제공된 문서에 근거가 없어 답변드릴 수 없습니다.
+Faithfulness,which British coming of age sitcom television series was James Buckley  known for playing Jay Cartwright in  ,False,0.311,faithfulness_check,True,GROUNDED,제공된 문서에 근거가 없어 답변드릴 수 없습니다.
+Faithfulness,What did Abd el-Krim regret not attacking?,True,0.435,,False,GROUNDED,"Abd el-Krim regretted not attacking Melilla, which was the biggest base of the Spanish troops in the eastern Rif. He later admitted that his decision to order his forces not to attack the town was his biggest mistake, as it allowed the Spanish to regroup and eventually begin the process of recovering lost territory."
+Faithfulness,"Signet Jewelers owns what Delaware based retailer, along with Kay and Jared?",True,0.804,,False,GROUNDED,"Signet Jewelers owns the Delaware-based retailer Zales, along with Kay Jewelers and Jared."
