config,question,in_doc,top_score,controls_triggered,abstained,verdict,answer
+Faithfulness,"Joseph Bottum wrote about what type of politics, best known for being practiced by adherents from the 1970s through the 2000s?",False,0.301,faithfulness_check,True,GROUNDED,제공된 문서에 근거가 없어 답변드릴 수 없습니다.
+Faithfulness,salary exchange pension contributions,True,0.655,,False,GROUNDED,"Salary exchange, also known as salary sacrifice, is a financial arrangement where an employee agrees to give up a portion of their salary or bonus in exchange for a non-cash benefit, typically a pension contribution made by their employer. This method allows both employers and employees to save money on National Insurance Contributions (NICs).  Here’s how it works:  1. **Salary Waiver**: The employee waives a part of their salary equivalent to their regular pension contribution. For example, if an employee's regular pension contribution is 7.5% of their pay, they would agree to reduce their salary by that same percentage.  2. **Employer Contribution**: In return for the salary reduction, the employer makes a corresponding contribution to the employee's pension scheme. This means that the employee's pension savings can increase without a direct reduction in take-home pay.  3. **Tax Benefits**: Since the salary is reduced before tax is calculated, employees may pay less income tax and NICs, leading to potential savings. Employers also benefit from lower NICs due to the reduced salary.  4. **Example**: For instance, if an employee is part of the Universities Superannuation Scheme (USS), their regular contribution is 7.5% of their salary. By opting for salary exchange, they effectively redirect that amount into their pension, enhancing their retirement savings while enjoying tax benefits.  Overall, salary exchange can be a beneficial strategy for both employees looking to boost their pension contributions and employers aiming to reduce their payroll costs."
+Faithfulness,What is the name of the director and actor with success that led to work on a film which follows a group of friends who discover an alien invasion during an epic pub crawl?,False,0.31,faithfulness_check,True,GROUNDED,제공된 문서에 근거가 없어 답변드릴 수 없습니다.
+Faithfulness,How many losses did the Hawks have in January?,False,0.211,,False,GROUNDED,"제공된 참고 문서에는 ""Hawks""라는 팀이나 그들의 경기 결과에 대한 정보가 포함되어 있지 않습니다. 따라서 Hawks의 1월 경기에서의 패배 수에 대한 정보를 제공할 수 없습니다. 더 구체적인 질문이나 다른 팀에 대한 정보가 필요하시면 말씀해 주세요!"
+Faithfulness,In what year was the book published that first talks about biopower?,False,0.22,faithfulness_check,True,GROUNDED,제공된 문서에 근거가 없어 답변드릴 수 없습니다.
+Faithfulness,Move Under Ground combines the cosmic horror of H.P. Lovecraft's Cthulhu Mythos with the Beat style of an American novelist and poet who was born when?,True,0.767,,False,GROUNDED,"Move Under Ground combines the cosmic horror of H.P. Lovecraft's Cthulhu Mythos with the Beat style of Jack Kerouac, who was born on March 12, 1922."
+Faithfulness,The Cross Coounty Community School's mascot is the second-heaviest cat after which animal?,True,0.719,faithfulness_check,True,GROUNDED,제공된 문서에 근거가 없어 답변드릴 수 없습니다.
+Faithfulness,"When did the British/Irish digital television channel, which features Spliced, first launch?",False,0.219,,False,GROUNDED,"죄송하지만, 제공된 참고 문서에는 British/Irish 디지털 텔레비전 채널과 관련된 정보가 포함되어 있지 않습니다. 따라서 Spliced가 방영되는 채널의 출시 날짜에 대한 정보를 제공할 수 없습니다. 추가적인 질문이나 다른 주제에 대해 궁금한 점이 있으시면 말씀해 주세요!"
+Faithfulness,In which year did Tom Gray aid in the discovery of a hominid fossil,False,0.218,,False,GROUNDED,주어진 참고 문서에는 Tom Gray가 호미니드 화석 발견에 기여한 연도에 대한 정보가 포함되어 있지 않습니다. 따라서 이 질문에 대한 정확한 답변을 제공할 수 없습니다. 추가적인 정보가 필요하시다면 다른 자료를 참고하시거나 구체적인 질문을 해주시면 도움을 드리겠습니다.
+Faithfulness,"What do these both have in common, the military or the secret service?",False,0.213,faithfulness_check,True,GROUNDED,제공된 문서에 근거가 없어 답변드릴 수 없습니다.
+Faithfulness,"Matt Doheny ran in the Republican primary for New York's 21st congressional district, a congressional district for the United States House of Representatives that is currently represented by who?",False,0.25,faithfulness_check,True,GROUNDED,제공된 문서에 근거가 없어 답변드릴 수 없습니다.
+Faithfulness,What position did the professional athlete play who was the grandson of the man who designed the Los Angelos Rams Logo?,False,0.257,,False,GROUNDED,죄송하지만 제공된 참고 문서에는 로스앤젤레스 램스 로고를 디자인한 사람의 손자에 대한 정보나 그가 어떤 포지션에서 활동했는지에 대한 내용이 포함되어 있지 않습니다. 추가적인 정보가 필요하시다면 다른 자료를 참조하시거나 구체적인 질문을 해주시면 도와드리겠습니다.
+Faithfulness,Who won the Super Bowl that Big Bad Voodoo Daddy performed at the half-time show?,True,0.504,,False,GROUNDED,"Big Bad Voodoo Daddy performed at the half-time show of Super Bowl XXXIII, which took place in 1999. The Denver Broncos won that game, defeating the Atlanta Falcons with a score of 34–19. This victory marked the Broncos' second consecutive Super Bowl win."
+Faithfulness,Are University of Patras and Manhattan College both public universities?,True,0.706,,False,GROUNDED,"아니요, University of Patras는 공립 대학이지만, Manhattan College는 사립 대학입니다. University of Patras는 그리스의 파트라스에 위치한 공립 대학이며, Manhattan College는 미국 뉴욕 브롱크스에 위치한 사립 로마 가톨릭 자유 예술 대학입니다."
+Faithfulness,"Call Me is the theme to ""American Gigolo"", written by a rock band of which nationality?",False,0.26,faithfulness_check,True,GROUNDED,제공된 문서에 근거가 없어 답변드릴 수 없습니다.
+Faithfulness,"Savage Grace is based on the dysfunctional, allegedly incestuous relationship between which wealthy American socialite who was murdered and her son, Antony?",True,0.532,,False,GROUNDED,"""Savage Grace""는 부유한 미국 사회계 여성인 바바라 데일리 베이클랜드(Barbara Daly Baekeland)와 그녀의 아들 앤서니 ""토니"" 베이클랜드(Anthony ""Tony"" Baekeland) 간의 기능 장애가 있는, 주장된 근친상간 관계를 바탕으로 하고 있습니다. 바바라 베이클랜드는 1972년에 아들에 의해 살해되었습니다."
+Faithfulness,What 2014 French comedy won two awards at the 20th Lumières Awards?,True,0.602,,False,GROUNDED,"2014 French comedy ""Love at First Fight"" (French: Les Combattants) won two awards at the 20th Lumières Awards. The film, directed by Thomas Cailley, is a romantic comedy that has received positive recognition for its unique storytelling and performances."
+Faithfulness,How many in percent from the census weren't swedish?,True,0.476,faithfulness_check,True,GROUNDED,제공된 문서에 근거가 없어 답변드릴 수 없습니다.
+Faithfulness,Me and the Colonel was a film based on the play by the novelist of what nationality?,False,0.357,faithfulness_check,True,GROUNDED,제공된 문서에 근거가 없어 답변드릴 수 없습니다.
+Faithfulness,"Henry Chidley Reynolds, was a New Zealand farm manager, butter manufacturer and exporter, he began manufacturing butter in 1886 and soon adopted as a brand name, Anchor, a brand of dairy products that was founded in New Zealand, in which year?",False,0.231,faithfulness_check,True,GROUNDED,제공된 문서에 근거가 없어 답변드릴 수 없습니다.
+Faithfulness,"Which competitor to ""Strange Stories"" was edited by John W. Campbell?",True,0.728,,False,GROUNDED,"""Strange Stories"" was unable to compete with ""Unknown"" (also known as ""Unknown Worlds""), which was edited by John W. Campbell."
+Faithfulness,What is the FY2021 unadjusted EBITDA less capex for AMD? Define unadjusted EBITDA as unadjusted operating income + depreciation and amortization [from cash flow statement]. Answer in USD millions. Calculate what was asked by utilizing the line items clearly shown in the cash flow statement and the P&L statement.,True,0.538,,False,GROUNDED,"To calculate the FY2021 unadjusted EBITDA less capex for Advanced Micro Devices, Inc. (AMD), we will follow these steps:  1. **Calculate Unadjusted EBITDA**:    - Unadjusted EBITDA = Unadjusted Operating Income + Depreciation and Amortization    - From the Consolidated Statements of Operations:      - Operating Income (FY2021): $3,648 million    - From the Consolidated Statements of Cash Flows:      - Depreciation and Amortization (FY2021): $407 million     Therefore,     \[    \text{Unadjusted EBITDA} = 3,648 + 407 = 4,055 \text{ million USD}    \]  2. **Calculate Capex**:    - Capex (Capital Expenditures) is represented by the Purchases of Property and Equipment in the cash flow statement.    - From the Consolidated Statements of Cash Flows:      - Purchases of Property and Equipment (FY2021): $(301) million  3. **Calculate Unadjusted EBITDA less Capex**:    - Unadjusted EBITDA less Capex = Unadjusted EBITDA - Capex    - Since capex is a cash outflow, we will subtract it:    \[    \text{Unadjusted EBITDA less Capex} = 4,055 - 301 = 3,754 \text{ million USD}    \]  Thus, the FY2021 unadjusted EBITDA less capex for AMD is **$3,754 million USD**."
+Faithfulness,Grégory Levasseur produced the 2003 horror film directed by whom?,True,0.701,,False,GROUNDED,"Grégory Levasseur는 2003년 공포 영화 ""High Tension""을 제작하였으며, 이 영화는 Alexandre Aja가 감독했습니다."
+Faithfulness,Does the valine allele of the V89L polymorphism in the 5-alpha-reductase gene confer a reduced risk for hypospadias?,True,0.753,,False,GROUNDED,"네, 발린(Valine) 대립유전자(V89 allele)인 V89L 다형성은 하이포스파디아(hypospadias)에 대한 위험을 감소시키는 것으로 나타났습니다. 연구에 따르면, V89 대립유자를 가진 동형접합체(homozygous individuals)는 하이포스파디아에 대한 보호 효과가 있으며, 이 대립유전자가 하이포스파디아와 유의미한 부정적 연관성을 보였습니다. 구체적으로, V89 대립유전자를 가진 경우의 오즈비(odds ratio)는 0.24로, 이는 V89 대립유전자가 하이포스파디아 발생 위험을 76% 감소시킨다는 것을 의미합니다. 따라서, 발린 대립유전자는 하이포스파디아의 발생에 대해 보호적인 역할을 하는 것으로 해석할 수 있습니다."
+Faithfulness,Which Yale professor has written 150 articles for the American mass circulation monthly magazine that features scientific information on child development?,True,0.503,,False,GROUNDED,"James P. Comer, the Maurice Falk Professor of Child Psychiatry at the Yale Child Study Center, has written more than 150 articles for the American mass circulation monthly magazine ""Parents,"" which features scientific information on child development to assist parents in raising their children."
+Faithfulness,In which year did Lawrence Fishburne play an early pioneer of of fifties rock and roll?,True,0.347,,False,GROUNDED,"Laurence Fishburne played the role of Ike Turner, an early pioneer of fifties rock and roll, in the film ""What's Love Got to Do with It,"" which was released in 1993."
+Faithfulness,Are serum calcium levels elevated among women with untreated postmenopausal breast cancer?,False,0.284,faithfulness_check,True,GROUNDED,제공된 문서에 근거가 없어 답변드릴 수 없습니다.
+Faithfulness,The British National Party (BNP) subscribes to what form of radical authoritarian nationalism?,True,0.778,,False,GROUNDED,"The British National Party (BNP) subscribes to fascism, which is a form of radical authoritarian nationalism. Fascism is characterized by dictatorial power, the forcible suppression of opposition, and control of industry and commerce. It gained prominence in early 20th-century Europe and is associated with far-right ideologies."
+Faithfulness,Saint Seiya: Next Dimension is published in which Akita Shoten-published manga magazine?,True,0.482,,False,GROUNDED,"""Saint Seiya: Next Dimension""는 Akita Shoten에서 발행하는 주간 만화 잡지인 ""Weekly Shōnen Champion""에 게재됩니다. 이 잡지는 불규칙한 날짜에 발행됩니다."
+Faithfulness,"Which opera is by Christoph Willibald Gluck, Iphigénie en Tauride or Der Barbier von Bagdad?",False,0.388,faithfulness_check,True,GROUNDED,제공된 문서에 근거가 없어 답변드릴 수 없습니다.
+Faithfulness,The Reid Report is hosted by the correspondent who is also a commentator on what website?,False,0.257,faithfulness_check,True,GROUNDED,제공된 문서에 근거가 없어 답변드릴 수 없습니다.
+Faithfulness,Eye for an Eye is a 1996 American psychological thriller film starring an American actor who currently stars in what HBO sci-fi drama series?,True,0.687,,False,GROUNDED,"Eye for an Eye는 1996년 미국의 심리 스릴러 영화로, 현재 HBO의 공상 과학 드라마 시리즈 ""Westworld""에 출연 중인 미국 배우 에드 해리스(Edward Harris)가 출연합니다."
+Faithfulness,Are nucleoside analogues activated by bacterial deoxyribonucleoside kinases in a species-specific manner?,False,0.265,faithfulness_check,True,GROUNDED,제공된 문서에 근거가 없어 답변드릴 수 없습니다.
+Faithfulness,What city in California was home to a team that Robert Girard played hockey for?,True,0.699,,False,GROUNDED,"Robert Girard played for the California Golden Seals, a team based in Oakland, California."
+Faithfulness,The designers of the Horten H.XVIII also designed the world's first jet-powered flying wing known by what name?,False,0.207,faithfulness_check,True,GROUNDED,제공된 문서에 근거가 없어 답변드릴 수 없습니다.
+Faithfulness,Which French boxer defeated Hussein Ishaish at the 2016 Summer Olympics as an amateur?,False,0.343,faithfulness_check,True,GROUNDED,제공된 문서에 근거가 없어 답변드릴 수 없습니다.
+Faithfulness,How many countries were Circassian refugees thought to be fleeing to?,False,0.322,faithfulness_check,True,GROUNDED,제공된 문서에 근거가 없어 답변드릴 수 없습니다.
+Faithfulness,What form of theater do Sean Pol McGreevy and Mack and Mabel have in common?,False,0.229,faithfulness_check,True,GROUNDED,제공된 문서에 근거가 없어 답변드릴 수 없습니다.
+Threshold,Archduchess Catherine Renata of Austria is a member of one of the most influential and outstanding royal houses of Europe that was occupied by who between 1438-1740?,True,0.812,,False,GROUNDED,Archduchess Catherine Renata of Austria는 1438년부터 1740년까지 신성 로마 제국의 왕좌를 지속적으로 차지했던 하브스부르크 가문의 일원입니다. 하브스부르크 가문은 유럽에서 가장 영향력 있고 저명한 왕실 중 하나로 알려져 있습니다.
+Threshold,"What 2006 criminal case led by Mike Nifong was the basis of an episode of ""Law & Order""?",True,0.659,,False,GROUNDED,"2006년 마이크 니퐁(Mike Nifong)이 이끌었던 범죄 사건은 듀크 대학 남자 라크로스 팀의 세 명이 잘못된 성폭행 혐의를 받았던 듀크 라크로스 사건(Duke lacrosse case)입니다. 이 사건은 ""Law & Order""의 ""Out of Control"" 에피소드의 기초가 되었습니다. 사건의 해결은 인종차별, 언론 편향, 캠퍼스 내 절차적 정의에 대한 공적 논의를 촉발하였고, 결국 주도 검사인 니퐁의 사임과 변호사 자격 박탈로 이어졌습니다."
+Threshold,Who is Ronald Dworkin?,False,0.256,confidence_threshold,True,GROUNDED,관련 정보 없음: 제공된 응급처치 문서에서 해당 내용을 찾을 수 없습니다.
+Threshold,What game was Sidney Crosby awarded his second Conn Smythe Trophy?,False,0.292,confidence_threshold,True,GROUNDED,관련 정보 없음: 제공된 응급처치 문서에서 해당 내용을 찾을 수 없습니다.
+Threshold,Vanessa Kirby played Joanna Richard Curtis' movie released on what date?,True,0.424,confidence_threshold,True,GROUNDED,관련 정보 없음: 제공된 응급처치 문서에서 해당 내용을 찾을 수 없습니다.
+Threshold,Where did Beatrice Helen Beckett's husband serve as prime minister?,False,0.327,confidence_threshold,True,GROUNDED,관련 정보 없음: 제공된 응급처치 문서에서 해당 내용을 찾을 수 없습니다.
+Threshold,What Trust did the author of The Tale of Jemima Puddle-Duck leave her house to?,False,0.237,confidence_threshold,True,GROUNDED,관련 정보 없음: 제공된 응급처치 문서에서 해당 내용을 찾을 수 없습니다.
+Threshold,"Israeli actress, Odeya Rush, is known for her lead role in 2015 American horror comedy film based on the children's book series created by what author?",True,0.688,,False,GROUNDED,"Odeya Rush는 2015년 미국의 호러 코미디 영화 ""Goosebumps""에서 주연을 맡았으며, 이 영화는 R.L. Stine이 만든 어린이 책 시리즈를 기반으로 하고 있습니다."
+Threshold,Is resection of residual disease after isolated limb infusion ( ILI ) equivalent to a complete response after ILI-alone in advanced extremity melanoma?,False,0.229,confidence_threshold,True,GROUNDED,관련 정보 없음: 제공된 응급처치 문서에서 해당 내용을 찾을 수 없습니다.
+Threshold,"Who was born first, Ken Hughes or Peter Duffell?",False,0.267,confidence_threshold,True,GROUNDED,관련 정보 없음: 제공된 응급처치 문서에서 해당 내용을 찾을 수 없습니다.
+Threshold,"When was the singer of ""Funny Face"" born? ",False,0.245,confidence_threshold,True,GROUNDED,관련 정보 없음: 제공된 응급처치 문서에서 해당 내용을 찾을 수 없습니다.
+Threshold,Is bilirubin independently associated with oxidized LDL levels in young obese patients?,False,0.303,confidence_threshold,True,GROUNDED,관련 정보 없음: 제공된 응급처치 문서에서 해당 내용을 찾을 수 없습니다.
+Threshold,What is the FY2020 unadjusted EBITDA less capex for PepsiCo? Define unadjusted EBITDA as unadjusted operating income + depreciation and amortization [from cash flow statement]. Answer in USD millions. Give a response to the question by relying on the details shown in the P&L statement and the statement of cash flows.,False,0.421,confidence_threshold,True,GROUNDED,관련 정보 없음: 제공된 응급처치 문서에서 해당 내용을 찾을 수 없습니다.
+Threshold,"Godspeed, was under Captain Bartholomew Gosnold, an English lawyer, explorer, and privateer who was instrumental in founding of which organization?",False,0.283,confidence_threshold,True,GROUNDED,관련 정보 없음: 제공된 응급처치 문서에서 해당 내용을 찾을 수 없습니다.
+Threshold,"From the perspective of a public equities analyst, please answer the following question by primarily taking information that is provided in the P&L statement and the cash flow statement. What is Amcor's FY2020 retention ratio (using total cash dividends paid and net income attributable to shareholders)? Round answer to two decimal places.",False,0.473,confidence_threshold,True,GROUNDED,관련 정보 없음: 제공된 응급처치 문서에서 해당 내용을 찾을 수 없습니다.
+Threshold,Are both Roberto Devereux and King Priam operas?,True,0.744,,False,GROUNDED,"네, Roberto Devereux와 King Priam은 모두 오페라입니다. Roberto Devereux는 가에타노 도니제티(Gaetano Donizetti)가 작곡한 ""트라제디아 리리카"" 또는 비극 오페라입니다. 반면, King Priam은 마이클 티펫(Michael Tippett)이 자신의 대본을 바탕으로 작곡한 오페라입니다. 두 작품 모두 오페라 장르에 속하지만, 서로 다른 작곡가와 스타일을 가지고 있습니다."
+Threshold,Who is married to Jim Tomlinson and released an album entitled Raconte-moi?,True,0.636,,False,GROUNDED,"Stacey Kent is married to Jim Tomlinson and released an album entitled ""Raconte-moi"" in 2010."
+Threshold,Is kAP1 associated with peritoneal carcinomatosis in gastric cancer?,True,0.726,,False,GROUNDED,"네, KAP1은 위암에서 복막암종(peritoneal carcinomatosis)과 관련이 있습니다. 연구에 따르면, KAP1의 발현이 높은 환자들은 복막암종의 발생률이 더 높았으며(P < .05), KAP1의 높은 발현은 독립적인 예후 인자로 나타났습니다. 즉, KAP1의 발현 수준이 높을수록 복막암종의 위험이 증가하는 것으로 확인되었습니다. 이러한 결과는 KAP1이 위암의 진행 및 예후에 중요한 역할을 할 수 있음을 시사합니다."
+Threshold,"What 1977 film written and directed by Claude Chabrol is loosely based on a novel by the author of the poem ""Jabberwocky""?",True,0.631,,False,GROUNDED,"1977년 영화 ""Alice or the Last Escapade"" (프랑스어: ""Alice ou la dernière fugue"")는 Claude Chabrol이 작성하고 감독한 작품으로, Lewis Carroll의 ""Alice's Adventures in Wonderland""에서 매우 느슨하게 영감을 받았습니다. Lewis Carroll은 ""Jabberwocky""라는 시의 저자이기도 합니다."
+Threshold,"Jon Ippolito is an artist, educator, new media scholar, and former curator at the Solomon R. Guggenheim Museum, the museum is often referred to as The Guggenheim, is an art museum located at 1071 Fifth Avenue on the corner of East 89th Street in the Upper East Side neighborhood of Manhattan, in which city?",False,0.303,confidence_threshold,True,GROUNDED,관련 정보 없음: 제공된 응급처치 문서에서 해당 내용을 찾을 수 없습니다.
+Threshold,What is the name of the 1972 film based on Nicholas Monsarrat's novel and stars Colin Blakely?,True,0.574,,False,GROUNDED,"The name of the 1972 film based on Nicholas Monsarrat's novel and starring Colin Blakely is ""Something to Hide,"" which was also reissued in the U.S. as ""Shattered."""
+Threshold,"Along with the New York Islanders and the New York Rangers, which other NHL franchise is popular in the New York metropolitan area?",False,0.249,confidence_threshold,True,GROUNDED,관련 정보 없음: 제공된 응급처치 문서에서 해당 내용을 찾을 수 없습니다.
+Threshold,Which politician was once a Lieutenant Governor of Kentucky and a mayor in Louisville?,True,0.422,confidence_threshold,True,GROUNDED,관련 정보 없음: 제공된 응급처치 문서에서 해당 내용을 찾을 수 없습니다.
+Threshold,In what year was the camp opened that is between the city of Wodonga and the dam across the Murray River downstream of its junction with the Mitta River?,False,0.204,confidence_threshold,True,GROUNDED,관련 정보 없음: 제공된 응급처치 문서에서 해당 내용을 찾을 수 없습니다.
+Threshold,Buddhist Yip Kei Nam Memorial College the school was founded with funds from a gambling tycoon whose wealth was estimated to be what?,True,0.663,,False,GROUNDED,"Buddhist Yip Kei Nam Memorial College was founded with funds from Yip Hon (葉漢), a gambling tycoon in Hong Kong and Macau, whose wealth was estimated to be HK$ 100 million."
+Threshold,"Gerald William Heaney, served for nearly forty years as a federal judge on the United States Court of Appeals for the Eighth Circuit, and was an organizer for several liberal Democratic politicians, including which former   American politician, poet, and a long-time Congressman from Minnesota?",True,0.472,confidence_threshold,True,GROUNDED,관련 정보 없음: 제공된 응급처치 문서에서 해당 내용을 찾을 수 없습니다.
+Threshold,What 2014 American 3D computer-animated musical fantasy adventure comedy film features a song recorded by British singer Leah McFall?,False,0.293,confidence_threshold,True,GROUNDED,관련 정보 없음: 제공된 응급처치 문서에서 해당 내용을 찾을 수 없습니다.
+Threshold,"Who is older, Michael Howard or Clark Johnson?",False,0.252,confidence_threshold,True,GROUNDED,관련 정보 없음: 제공된 응급처치 문서에서 해당 내용을 찾을 수 없습니다.
+Threshold,Are Jan Bucquoy and Richard Linklater of the same nationality?,True,0.73,,False,GROUNDED,"아니요, Jan Bucquoy와 Richard Linklater는 서로 다른 국적을 가지고 있습니다. Jan Bucquoy는 벨기에 출신으로, 벨기에에서 태어났습니다. 반면, Richard Linklater는 미국 출신으로, 미국에서 태어났습니다. 따라서 두 사람은 같은 국적이 아닙니다."
+Threshold,Does association of Dry Eye test With Extraocular Signs Among 3514 Participants in the Sjögren 's Syndrome International Registry?,False,0.273,confidence_threshold,True,GROUNDED,관련 정보 없음: 제공된 응급처치 문서에서 해당 내용을 찾을 수 없습니다.
